{
  "_notes": [
    "Class of 1812 (1991), Gottlieb System 3, Alphanumeric, 8-digit scores",
    "Audits/Adjustments stored in triplicate at 0x680, 0x700, 0x780",
    "Based on cactjack.map.json."
  ],
  "_fileformat": 0.9,
  "_metadata": {
    "version": 6,
    "copyright": [
      "Copyright (C) 2025 by Tom Collins <tom@scorbit.io>"
    ],
    "license": "Open Data Commons Open Database License (ODbL) v1.0",
    "platform": "gottlieb-system3",
    "roms": [
      "clas1812"
    ],
    "validation": {
      "mirror": [
        {
          "label": "Working Memory",
          "length": "0x91",
          "offsets": [
            "0x400",
            "0x521",
            "0x5B2"
          ]
        },
        {
          "label": "Audits/Settings/High Scores",
          "length": "0x80",
          "offsets": [
            "0x680",
            "0x700",
            "0x780"
          ]
        }
      ]
    }
  },
  "game_state": {
    "scores": [
      {
        "label": "Player 1",
        "encoding": "bcd",
        "nibble": "low",
        "length": 8,
        "start": "0x001"
      },
      {
        "label": "Player 2",
        "encoding": "bcd",
        "nibble": "low",
        "length": 8,
        "start": "0x00D"
      },
      {
        "label": "Player 3",
        "encoding": "bcd",
        "nibble": "low",
        "length": 8,
        "start": "0x015"
      },
      {
        "label": "Player 4",
        "encoding": "bcd",
        "nibble": "low",
        "length": 8,
        "start": "0x021"
      }
    ],
    "credits": {
      "_notes": "mirrored to 0x1E/0x1F (ascii), 0x5B1, and 0x642 as well",
      "label": "Credits",
      "start": "0x490",
      "encoding": "bcd"
    },
    "max_credits": {
      "label": "Max Credits",
      "start": "0x6BD",
      "encoding": "bcd"
    },
    "free_play": {
      "label": "Free Play",
      "start": "0x6CB",
      "encoding": "bool"
    },
    "current_ball": {
      "_notes": "set to 0 when game over; stores ASCII value (0x30 - 0x35)",
      "label": "Ball",
      "start": "0x0B",
      "mask": "0x0F",
      "encoding": "bcd"
    },
    "ball_count": {
      "label": "Ball Count",
      "start": "0x6BF",
      "encoding": "bcd"
    },
    "current_player": {
      "_notes": "0-3; bit 7 (0x80) sometimes set?",
      "label": "Current Player",
      "short_label": "P#",
      "start": "0x343",
      "encoding": "int",
      "mask": "0x0F",
      "offset": 1
    },
    "player_count": {
      "_notes": "set to 0 when game over",
      "label": "Player Count",
      "short_label": "Players",
      "start": "0x342",
      "encoding": "int"
    },
    "game_over": {
      "label": "Game Over",
      "start": "0x342",
      "encoding": "bool",
      "invert": true
    }
  },
  "high_scores": [
    {
      "label": "High Score #1",
      "short_label": "#1",
      "initials": {
        "start": "0x686",
        "encoding": "ch",
        "length": 3
      },
      "score": {
        "encoding": "bcd",
        "length": 4,
        "start": "0x69A"
      }
    },
    {
      "label": "High Score #2",
      "short_label": "#2",
      "initials": {
        "start": "0x68A",
        "encoding": "ch",
        "length": 3
      },
      "score": {
        "encoding": "bcd",
        "length": 4,
        "start": "0x69E"
      }
    },
    {
      "label": "High Score #3",
      "short_label": "#3",
      "initials": {
        "start": "0x68E",
        "encoding": "ch",
        "length": 3
      },
      "score": {
        "encoding": "bcd",
        "length": 4,
        "start": "0x6A2"
      }
    },
    {
      "label": "High Score #4",
      "short_label": "#4",
      "initials": {
        "start": "0x692",
        "encoding": "ch",
        "length": 3
      },
      "score": {
        "encoding": "bcd",
        "length": 4,
        "start": "0x6A6"
      }
    },
    {
      "label": "High Score #5",
      "short_label": "#5",
      "initials": {
        "start": "0x696",
        "encoding": "ch",
        "length": 3
      },
      "score": {
        "encoding": "bcd",
        "length": 4,
        "start": "0x6AA"
      }
    }
  ]
}
